47,https://cwe.mitre.org/data/definitions/47.html,path equivalence: 'filename' (leading space),Jasmine,"The product accepts path input in the form of leading space (' filedir') without appropriate validation, which can lead to ambiguous path resolution and allow an attacker to traverse the file system to unintended locations or access arbitrary files.",An input for a pathname is required but no check for the appropriate pathname is checked for.,undefined behavior,"read files, read directories, modify files, modify directories",file processing,input validation and representation,lack of knowledge,high,lack of security requirements ,medium,,,,,,,,,
173,https://cwe.mitre.org/data/definitions/173.html,improper handling of alternate encoding,Jasmine,The product accepts an alternate form of encoding but does not account for this alternatve form when processing input.,input of of UTF-16 is used instead of the common UTF-8 format that the program only accounts for.,undefined behavior,"bypass protection mechanism, encoding error","input validation, output encoding",input validation and representation,lack of knowledge,high,lack of security requirements ,medium,,,,,,,,,
522,https://cwe.mitre.org/data/definitions/522.html,Insufficiently Protected Credentials,Jasmine,"The product transmits or stores authentication credentials, but it uses an insecure method that is susceptible to unauthorized interception and/or retrieval."," the code confirms that the requesting user typed the same new password twice, it does not confirm that the user requesting the password change is the same user whose password will be changed.",Security Threat,"gain privileges, assume identity","secure method, cryptography, automated static analysis",API abuse,lack of security requirements ,high,biased review,medium ,,,,,,,,,
5,https://cwe.mitre.org/data/definitions/5.html,Misconfiguration: Data Transmission Without Encryption,Jasmine,Information sent over a network can be compromised while in transit.,An attacker may be able to read or modify the contents if the data are sent in plaintext or are weakly encrypted.,Security Threat,"read application data, modify application data","secure transport, secure encryption, system configuration",Enviornment,lack of security requirements ,medium,,,,,,,,,,,
38,https://cwe.mitre.org/data/definitions/38.html,Path Traversal: '\absolute\pathname\here',Jasmine,"The product accepts input in the form of a backslash absolute path ('\absolute\pathname\here') without appropriate validation, which can allow an attacker to traverse the file system to unintended locations or access arbitrary files.","A program using a directory path does not treat all inputs as possibly mallicious, therefore, the program does not account for the pathname to start from the root.","Security Threat, undefined behavior","read files, read directories, modify files, modify directories","input validation, automated static analysis",Code quality,lack of security requirements ,high,biased review ,high,,,,,,,,,
52,https://cwe.mitre.org/data/definitions/52.html,Path Equivalence: '/multiple/trailing/slash//',Jasmine,"The product accepts path input in the form of multiple trailing slash ('/multiple/trailing/slash//') without appropriate validation, which can lead to ambiguous path resolution.",Can allow an attacker to traverse the file system to unintended locations or access arbitrary files.,"Security Threat, undefined behavior","read files, modify files, modify directories",input validation,input validation and representation,lack of security requirements ,high,biased review,high,,,,,,,,,
56,https://cwe.mitre.org/data/definitions/56.html,Path Equivalence: 'filedir*' (Wildcard),Jasmine,"The product accepts path input in the form of asterisk wildcard ('filedir*') without appropriate validation, which can lead to ambiguous path resolution and allow an attacker to traverse the file system to unintended locations or access arbitrary files.","The program requires input from user, rather than a safe pathname be inputted, an unaccounted for pathname using the wildcard character exposes the system to potentially harmful consequences.","Security Threat, undefined behavior","read files, read directories, modify files, modify directories","input validation, neutralization",input validation and representation,lack of security requirements ,high,biased review,high,,,,,,,,,
57,https://cwe.mitre.org/data/definitions/57.html,Path Equivalence: 'fakedir/../realdir/filename',Jasmine,"The product contains protection mechanisms to restrict access to 'realdir/filename', but it constructs pathnames using external input in the form of 'fakedir/../realdir/filename' that are not handled by those mechanisms. This allows attackers to perform unauthorized actions against the targeted file.","The program requires a pathname as an input, but inproper directory traversal checks are set up in program, leading to a user traversing to unauthorized locations.","Security Threat, undefined behavior","read files, read directories, modify files, modify directories",input validation,input validation and representation,lack of security requirements ,high,biased review,high,,,,,,,,,
107,,Struts: Unused Validation Form,Jasmine,An unused validation form indicates that validation logic is not up-to-date. It is easy for developers to forget to update validation logic when they remove or rename action form mappings. One indication that validation logic is not being properly maintained is the presence of an unused validation form.,,Security Threat,quality degradation,"input validation, bad coding practices",Code quality,forgetting something has been done ,medium,,,,,,,,,,,
127,https://cwe.mitre.org/data/definitions/127.html,Buffer Under-read,Jasmine,The product reads from a buffer using buffer access mechanisms such as indexes or pointers that reference memory locations prior to the targeted buffer.,A pogrammer writes a pointer to a place where the accessed memory is located before where the stored memory acually is.,"system crash, undefined behavior","read memory, bypass protection mechanism, system crash","automated static analysis, memory management",Code quality,Perceptual confusions,medium,confirmation bias,medium e,,,,,,,,,
145,https://cwe.mitre.org/data/definitions/145.html,Improper Neutralization of Section Delimiters,Jasmine,"The product receives input from an upstream component, but it does not neutralize or incorrectly neutralizes special elements that could be interpreted as section delimiters when they are sent to a downstream component.","One example of a section delimiter is the boundary string in a multipart MIME message. In many cases, doubled line delimiters can serve as a section delimiter.","undefined behavior, security threat",unexpected state,"neutralization, input validation, output encoding",input validation and representation,lack of security requirements ,high,biased review,medium,,,,,,,,,
347,https://cwe.mitre.org/data/definitions/347.html,Improper Verification of Cryptographic Signature,Jasmine,"The product does not verify, or incorrectly verifies, the cryptographic signature for data.",An attacker takes advantage of this weakpooint in cryptographic signatures to obtain data that is not theirs.,"Security Threat, undefined behavior","gain privileges, assume identity, execute unauthorized code","automated static analysis, cryptography",Security Features,selectivity,medium,biased review,medium,lack of security requirenments ,low,,,,,,,
349,https://cwe.mitre.org/data/definitions/349.html,Acceptance of Extraneous Untrusted Data With Trusted Data,Jasmine,"The product, when processing trusted data, accepts any untrusted data that is also included with the trusted data, treating the untrusted data as if it were trusted.",An attacker packages untrusted data with trusted data to bypass protection mechanism to gain access to and possibly modify sensitive data.,"Security Threat, undefined behavior","bypass protection mechanism, modify application data","data verification, input validation",input validation and representation,biased review ,high,lack of security requirements ,medium,,,,,,,,,
510,https://cwe.mitre.org/data/definitions/510.html,Trapdoor,Jasmine,"A trapdoor is a hidden piece of code that responds to a special input, allowing its user access to resources without passing through the normal security enforcement mechanism.",An attacker would have unknown capabilities if they are able to bypass through into this trapdoor area of the program.,"Security Threat, undefined behavior","execute unauthorized code, bypass protection mechanism","installation integrity, automated static analysis",Security Features,lack of security requirements ,high,lack of knowledge,high,,,,,,,,,
577,https://cwe.mitre.org/data/definitions/577.html,EJB Bad Practices: Use of Sockets,Jasmine,"The Enterprise JavaBeans specification requires that every bean provider follow a set of programming guidelines designed to ensure that the bean will be portable and behave consistently in any EJB container. In this case, the product violates the following EJB guideline: ""An enterprise bean must not attempt to listen on a socket, accept connections on a socket, or use a socket for multicast."" The specification justifies this requirement in the following way: ""The EJB architecture allows an enterprise bean instance to be a network socket client, but it does not allow it to be a network server. Allowing the instance to become a network server would conflict with the basic function of the enterprise bean-- to serve the EJB clients.""","a simple stateless Enterprise JavaBean  retrieves stock symbols and stock values. The Enterprise JavaBean creates a socket and listens for and accepts connections from clients on the socket. This violates the EJB specification by attempting to listen on a socket, accepting connections on a socket, or using a socket for multicast.",undefined behavior,quality degradation,ejb guidelines,API abuse,lack of knowledge,high,,,,,,,,,,,
614,https://cwe.mitre.org/data/definitions/614.html,Sensitive Cookie in HTTPS Session Without 'Secure' Attribute,Jasmine,The Secure attribute for sensitive cookies in HTTPS sessions is not set.,Attackers could retrieve unsecure cookies from users.,security threat,read application data,secure attributes,Security Features,lack of knowledge,medium,biased review,medium e,,,,,,,,,
684,https://cwe.mitre.org/data/definitions/684.html,Incorrect Provision of Specified Functionality,Jasmine,"When providing functionality to an external party, it is important that the product behaves in accordance with the details specified. When requirements of nuances are not documented, the functionality may produce unintended behaviors for the caller, possibly leading to an exploitable state.",an HTTP 404 status code is returned in the event of an IOException encountered in a Java servlet. A 404 code is typically meant to indicate a non-existent resource and would be somewhat misleading in this case.,"Security Threat, undefined behavior","quality degradation, behavioral problems, exploitable state",coding standards,API abuse,lack of knowledge,high,,,,,,,,,,,
1004,https://cwe.mitre.org/data/definitions/1004.html,Sensitive Cookie Without 'HttpOnly' Flag,Jasmine,"The product uses a cookie to store sensitive information, but the cookie is not marked with the HttpOnly flag.", cookie is used to store a session ID for a client's interaction with a website. The intention is that the cookie will be sent to the website with each request made by the client. The HttpOnly flag is not set for the cookie. An attacker who can perform XSS could insert malicious script.,,"gain privileges, assume identity, read application data",automated static analysis,,lack of security requirements ,high ,,,,,,,,,,,
1007,https://cwe.mitre.org/data/definitions/1007.html,Insufficient Visual Distinction of Homoglyphs Presented to User,Jasmine,"The product displays information or identifiers to a user, but the display mechanism does not make it easy for the user to distinguish between visually similar or identical glyphs (homoglyphs), which may cause the user to misinterpret a glyph and perform an unintended, insecure action.","a simple, trusted URL that a user may frequently access. However, the URL is comprised of Cyrillic characters that look identical to the expected ASCII characters. This results in most users not being able to distinguish between the two and assuming that the above URL is trusted and safe. The ""e"" is actually the ""CYRILLIC SMALL LETTER IE"" which is represented in HTML as the character &#x435, while the ""a"" is actually the ""CYRILLIC SMALL LETTER A"" which is represented in HTML as the character &#x430. The ""p"", ""c"", and ""o"" are also Cyrillic characters in this example. Viewing the source reveals a URL of ""http://www.&#x435;x&#x430;m&#x440;l&#x435;.&#x441;&#x43e;m"". An adversary can utilize this approach to perform an attack such as a phishing attack in order to drive traffic to a malicious website.",,Integrity,User interface,,lack of security requirements ,high,,,,,,,,,,,
400,https://cwe.mitre.org/data/definitions/400,Uncontrolled Resource Consumption,Keagan,Incorrect management of a limited resource allowing them to be maliciously allocated or consumed by attackers. The 3 scenarios that commonly lead to this are:  1.) Lack of throttling for the number of allocated resources 2.) Losing all references to a resource before reaching the shutdown stage  3.) Not closing/returning a resource after processing,"The developer may inadequately grasp the scale of their product and how many resources a user could consume, or they may improperly implement the mechanisms that prevent overconsumption of resources.  


Freeing a resource is often times the last step of a task, so it is possible that programmers devote more attention to the steps prior and then forget the last step.",Process slow-down,"cross-site scripting, log forgery","punycode, filtering",,rule deficiencies,Medium,biased review,Medium,post completion,Medium,biased review,Coding,,,,,
362,https://cwe.mitre.org/data/definitions/362,Concurrent Execution using Shared Resource with Improper Synchronization ('Race Condition'),Keagan,Shared resources can be modified by different code sequences running concurrently.,Typically originates from race conditions which occur when a program or part of a program forgets to implement exclusivity and atomicity.,,"resource consumption, system crash, system restart, read files, read directories, read application data, execute unauthorized code, gain privileges","environment hardening, synchronization",Time and State,poor tools,Low,rule deficiencies,Medium,biased review,Low,rule deficiencies,Coding,,,,,
798,https://cwe.mitre.org/data/definitions/798,Use of Hard Coded Credentials,Keagan,"Administrator / High Access login information is hard coded making the program vulnerable to attackers who can discover/steal the login information and utilize admin privileges maliciously.

Program requires credentials to access certain things, such as logging in to access a database, or having a special login for admin access. However, it is possible that these credentials are hard-coded in a configuration file, or they along with their verification checks are hardcoded allowing for attackers to more easily access the information. For example (if password == ""adminpassword"") kind of verfication check.","Developers are probably testing their security inadequately and not considering all the ways that a possible hard-coded authentication could be accessed.  Developers may find it hard to test for these kinds of things themselves, since if they coded the authentication, they may think of course it will be easy for them to find it but for someone else they may expect it to be harder than it actually is. ",,"read application data, gain privileges",encryption,Security Features,biased review,Medium,security culture,Medium,post completion,,overconfidence,Design,,,,,
787,https://cwe.mitre.org/data/definitions/787,Out-of-Bounds Write,Keagan,Performing some sort of action on a memory location that is outside of the buffer. Subsequent write operations can then have undefined results including rewriting / corrupting other parts of the memory allowing for attacks.," Developers don’t validate that the parameters of the function won’t cause the program to break / overflow the buffer, and don't utilize enough test cases to discover this issue. Adding on to that, sometimes omission of checking for error return values from certain functions calls leads to a buffer overflow via an unexpected parameter value. Nonetheless, a majority of these could be caught, debugged and fixed if there was adequate testing done.",,"modify memory, execute unauthorized commands, system crash, system restart, unexpected state","language selection, libraries, frameworks, environment hardening",Code Quality,rule deficiencies,Low,biased review,Medium,Forgetting Something Has Been Done,Medium,biased review,Coding,,,,,
287,https://cwe.mitre.org/data/definitions/287,Improper authentication / verification of user identity,Keagan,"Allows for unauthorized attackers to gain possibly sensitive information or execute harmful code. For example, using cookies to store relevant authentication information, and performing actions based on the values in cookies which can be altered by attackers.","Developer is unware of the importance of authenticating user, and doesn't place enough emphasis on repeatdely authenticating users before allowing them to access critical information.",,,,Input Validation and Representation,lack of knowledge,,biased review,,,,lack of knowledge,Review,,,,,
190,https://cwe.mitre.org/data/definitions/190,Integer Overflow / Wraparound,Keagan,when an integer value is incremented past its max value based depending on data type resulting in a very small or negative number. ,"More Dominant: Developers do not think it is necessary to check the result of a calculation and assume the result will always be greater after the calculation.

Less Dominant: Humans aren't used to numbers having a max value aside from infinity, so they may not consider the possibility of overflow.",,"system crash, system restart, modify memory, execute unauthorized commands, bypass protection mechanism","language selection, libraries, frameworks, input validation, build hardening",Code Quality,biased review,Medium,lack of knowledge,Low,abnormal inputs,Low,overconfidence,Review,,,,,
918,https://cwe.mitre.org/data/definitions/918,Server Side Request Forgery (SSRF),Keagan,Not sufficiently ensuring that a URL or similar request is being sent to the expected destination. Allows for possible bypassing of access controls and allows attackers to use the server to gain access to confidential content.,"Dominant: Developers are not aware of the fact that input can be passed to unexpected hosts or ports and the implications of such behavior.

Less Dominant: Improper limitation of what ports / hosts can receive URLs. Improper input sanitization of URLs is also a major cause of this.",,"read application data, execute unauthorized code, bypass protection mechanism",automated static analysis,API Abuse,biased review,Low,lack of knowledge,Low,unknown,High,lack of knowledge,Coding,,,,,
416,https://cwe.mitre.org/data/definitions/416,Use After Free,Keagan,"Reference memory, especially pointers after it has been freed causing unintended program behavior.","More Dominant: The code uses multiple pointers to places in memory and the developers mistakenly reference a similar pointer that has already been freed.

Less Dominant: Developers simply forget that they've already freed something, or may not understand that freeing should be the last step.",,"modify memory, system crash, system restart, execute unauthorized code","language selection, attack surface reduction, fuzz testing, automated static analysis",Code Quality,perceptual confusion,Medium,rule deficiencies,Low,Forgetting Something Has Been Done,Medium,perceptual confusion,Coding,,,,,
476,https://cwe.mitre.org/data/definitions/476,NULL Pointer Dereference,Keagan,"Dereferencing a pointer thought to be valid when it is actually null, can cause program crashes / exits.","More Dominant: Developers overlook the common practice to check whether or not pointers are NULL before dereferencing it.

Less Dominant: Improper implementation of synchronization mechanisms",,"system crash, system restart, execute unauthorized code, read memory, modify memory","proper locking apis, initialization, automated dynamic analysis, exception checks",Code Quality,perceptual confusion,Medium,rule deficiencies,Medium,,,rule deficiencies,Coding,,,,,
430,https://cwe.mitre.org/data/definitions/430,Deployment of Wrong Handler,Keagan,"The wrong ""handler"" is assigned to process an object. A handler is commonly a function routine or method tasked with handling a certain type of data or task.","A similar task may be successfully handled by one handler, however the task at hand although similar to that one is slightly different, thus making the handler that would typically be logical to use inadequate. For example, in most cases you hammer a nail, and screws are of similar shape/function to nails, however if you hammer a screw, it reduces its strength. More code specific examples include omitting a type check before interpretting an obejct. ",,,,Code Quality,confirmation bias,Low,rule deficiencies,Low,unknown,High,,Coding,,,,,
474,https://cwe.mitre.org/data/definitions/474,Use of Function with Inconsistent Implementations,Keagan,"Code utilizes calls to a function that has different implementations from version to version and across different OS. For example, the return values might be different, might handle the input parameters differently or in different order, might not be defined.","Developers not having the knowledge that a certain function may behave differently on different systems. Rather, it is more of an operating environment issue, and development tools directly causing the vulnerability, since I would consider function calls to be a development tool. Best example of a similar real-world comparison would be like a word meaning two different things across languages. EX: Kind means nice in English, but it means child in German.",,,,,operating environment,Medium,lack of review,Low,lack of knowledge,High,,Review,,,,,
256,https://cwe.mitre.org/data/definitions/256,Plaintext Storage of a Password,Keagan,"Password is stored in plaintext in the configuration, properties, or memory of an application, or somewhere equivalently easily accessed. Thus, any attackers who find the password which is easy in this case can gain access to critical information.

Always best practice to at least encrypt passwords in some way, or to not store them within the application they pertain to at the very least. ","Stem from the fact that developers don’t test adequately enough to discover this password vulnerability and think it's not plausible for an attacker with no prior information to do so. 

Humans also often opt for convenience over security, and storing a password in plaintext somewhere easily located is a prime example of that, I.e. writing your password down rather than memorizing it.",,,,Security Features,security culture,Medium,biased review,Low,,,,Design,,,,,
303,https://cwe.mitre.org/data/definitions/303,Incorrect Implementation of Authentication Algorithm,Keagan,"The requirements for the product dictate the use of an established authentication algorithm, but the implementation of the algorithm is incorrect.","Dominant Scenario: The description of this vulnerability assumes the security requirements exist, and use of an established authentication algorithm. Thus, it is fair to assume that the developer has knowledge of the algorithm, however the implementation is incorrect or incomplete.

Not as dominant: During testing, they only performed tests that made it appear the algorithm was working correctly.",,bypass protection mechanism,"authentication errors, weak authentication",Code Quality,rule deficiencies,High,confirmation bias,Medium,,,rule deficiencies,Coding,,,,,
212,https://cwe.mitre.org/data/definitions/212,Improper Removal of Sensitive Information Before Storage or Transfer,Keagan,"Critical information within a resource is stored, transferred, or shared before being concealed / removed from the resource. Thus, the information may be available or accessed by possible attackers. Most common resources in which this is relevant include packets, messages, databases, etc.","Deleting or concealing the sensitive information may be the last step before sharing, storing or transferring the resource making it more likely to be forgotten. Kind of like not signing out of a public computer upon finishing your work. 

Not as dominant scenarios: Possible that the sensitive information was made available between a trusted group of people for ease of access reasons, but one member shared the resource outside of the group thinking the information had already been removed. Lastly, there could be a possibility that there was an attempt to remove / conceal the information however it was just done inadequately.",,"read files, read directories, read application data","separation of privileges, attack surface reduction, automated static analysis",Encapsulation,rule deficiencies,Low,post completion,Medium,miscommunication,Low,post completion,Coding,,,,,
