693,https://cwe.mitre.org/data/definitions/693,Protection Mechanism Failure,Rylan,The product does not use or incorrectly uses a protection mechanism that provides sufficient defense against directed attacks against the product.,"Developers may not be aware or consider use of a provided security tool, potentially leading to a vulnerability that could’ve been easily mitigated.
Developers may use a security tool such as encryption to a believed expected standard, however, it may not meet modern day security requirements, such as level of encryption.",,,identity verification,Security Features,misused tools,High,unknown,Unknown,,,unknown,Coding,,,,,
352,https://cwe.mitre.org/data/definitions/352,Cross-Site Request Forgery,Rylan,"The web application does not, or can not, sufficiently verify whether a well-formed, valid, consistent request was intentionally provided by the user who submitted the request.","A lack a security requirements relating to request verification will likely lead to a vulnerability. 
 
Developers may review a program receiving requests and overlook the condition to verify the request, potentially leading to a vulnerability.",,"gain privileges, bypass security mechanism, system crash, system restart",,Input Validation and Representation,security culture,High,biased review,Low,,,biased review,Review,,,,,
434,https://cwe.mitre.org/data/definitions/434,Unrestricted Upload of File with Dangerous Type,Rylan,The product allows the attacker to upload or transfer files of dangerous types that can be automatically processed within the product's environment.,"A lack a security requirements relating to file verification will likely lead to a vulnerability. 
Developers may review a program receiving file uploads and overlook the condition to verify the file type, potentially leading to a vulnerability.",,"execute unauthorized code, execute unauthorized commands","libraries, frameworks, cross-site scripting, input validation",Input Validation and Representation,security culture,High,biased review,High,,,biased review,Design,,,,,
862,https://cwe.mitre.org/data/definitions/862,Missing Authorization,Rylan,The product does not perform an authorization check when an actor attempts to access a resource or perform an action.,"A lack a security requirements relating to actor authorization will likely lead to a vulnerability. 
Developers may review a program allowing users to access resources and overlook the condition to verify the authority of the user, potentially leading to a vulnerability.",,"gain privileges, bypass protection mechanism, system crash, system restart, read application data","input validation, environment hardening, authorize actors",Security Features,security culture,Medium,unknown,Unknown,,,biased review,Coding,,,,,
502,https://cwe.mitre.org/data/definitions/502,Deserialization of Untrusted Data,Rylan,The product deserializes untrusted data without sufficiently verifying that the resulting data will be valid.,"A lack a security requirements relating to verifying deserialized data will likely lead to a vulnerability. 
Developers may review a program allowing sources to submit serialized data to the software and overlook the condition to verify the resulting deserialized data, potentially leading to a vulnerability.",,"modify application data, unexpected state, resource consumption","libraries, frameworks, access control",,security culture,Medium,biased review,High,,,biased review,Review,,,,,
78,https://cwe.mitre.org/data/definitions/78,OS Command Injection,Rylan,"The product constructs all or part of an OS command using externally-influenced input from an upstream component, but it does not neutralize or incorrectly neutralizes special elements that could modify the intended OS command when it is sent to a downstream component.","A lack a security requirements relating to neutralizing escape characters will likely lead to a vulnerability. 
Developers may review a program constructing OS commands using user input and overlook the condition to neutralize escape characters potentially leading to a vulnerability.
",,"execute unauthorized code, system crash, system restart, read files, modify files, read application data","firewall, cryptography, input validation, error handling",Input Validation and Representation,security culture,Medium,biased review,High,,,biased review,Coding,,,,,
524,https://cwe.mitre.org/data/definitions/524,Use of Cache Containing Sensitive Information,Theo,"The code uses a cache that contains sensitive information, but the cache can be read by an actor outside of the intended control sphere.","Websites often use caches to temporarily store information provided by the user. If this information is not securely stored, vulnerabilities in the web browser could allow attackers to access this sensitive information.",,read application data,"libraries, frameworks, input validation, environment hardening, neutralization",Encapsulation,lack of knowledge,High,,,,,biased review,Design,,,,,
250,https://cwe.mitre.org/data/definitions/250,Execution with Unnecessary Privileges,Theo,"The program performs an operation at a privilege level that is higher than the minimum level required, which creates new weaknesses or amplifies the consequences of other weaknesses.","One common example of unnecessary privilege escalation is on Linux platforms, i.e. running as root.

It's also common for unnecessary privileges to be requested from an API, for example requesting mutable access to an object versus a read-only getter function.",,"gain privileges, execute unauthorized code, read application data, system crash, system restart","error handling, cache encryption",Security Features,biased review,High,,,,,,Coding,,,,,
617,https://cwe.mitre.org/data/definitions/617,Reachable Assertion,Theo,"The program contains an assert() or similar statement that can be triggered by an attacker, which leads to an application exit or other behavioe that is more severe than necessary.","Assertions are typically used during development of a program, but can cause unintended behavior if triggered in a production environment. Developers must make sure to exhaustively remove all leftover assertion functions.",,"system crash, system restart, off by one error","environment hardening, attack surface reduction, input validation, separation of privileges",Encapsulation,lack of review,High,,,,,post completion,Review,,,,,
1074,https://cwe.mitre.org/data/definitions/1074,Class with Excessively Deep Inheritance,Theo,"A class has an inheritance level that is too high, i.e., it has a large number of parent classes.","Excessive inheritance is a poor coding practice and serves as a distraction for developers, increasing the odds that vulnerabilities are introduced.",,,"input validation, control flow management,",Code Quality,complexity,High,,,,,,Design,,,,,
1080,https://cwe.mitre.org/data/definitions/1080,Source Code File with Excessive Number of Lines of Code,Theo,A source code file has too many lines of code.,Excessively large source code files can be difficult to maintain. This unnecessary complexity makes it more difficult for developers to maintain the code and increases the odds of vulnerabilities being introduced and missed.,,,,Code Quality,complexity,High,,,,,,Coding,,,,,
252,https://cwe.mitre.org/data/definitions/252,Unchecked Return Value,Theo,"The program does not check the return value from a method or function, which can prevent it from detecting unexpected states and conditions.","A developer may choose not to read the return value of a function, potentially missing the report of an error. The developer may believe that the error does not affect the operation of the program or that the odds of the error are negligble, but this is not a safe practice.",,"unexpected state, system crash, system restart",,API Abuse,overconfidence,High,,,,,overconfidence,Coding,,,,,
480,https://cwe.mitre.org/data/definitions/480,Use of Incorrect Operator,Theo,"The program accidentally uses the wrong operator, which changes the logic in security-relevant ways.","This defect may arise due to a typo. For example, = (single equals) and == (double equals) have different behaviors but a slip by the developer may result in the wrong one being typed.",,alter execution logic,"return values, null pointer dereference, error handling",Code Quality,perceptual confusion,High,,,,,perceptual confusion,Coding,,,,,
833,https://cwe.mitre.org/data/definitions/833,Deadlock,Theo,"The program contains multiple threads or executable segments that are waiting for each other to release a necessary lock, resulting in deadlock.",Developers should prepare for deadlock when designing multithreaded programs. Deadlock may occur when assumptions are made about the status of a resource.,,"resource consumption, system crash, system restart","control flow management, string errors",Time and State,biased review,High,,,,,lack of knowledge - sequencing issues,Design,,,,,
695,https://cwe.mitre.org/data/definitions/695,Use of Low-Level Functionality,Theo,The program uses low-level functionality that is explicitly prohibited by the framework or specification under which the product is supposed to operate.,"The developer may not be aware of certain features offered by the framework, and attempts to implement the functionality themselves. Additionally, they may feel confident in their ability to circumvent warnings provided by the framework about unsafe features.",,,"resource locking, resource management",Code Quality,lack of knowledge,Medium,overconfidence,Low,,,,Coding,,,,,
1041,https://cwe.mitre.org/data/definitions/1041,Use of Redundant Code,Theo,"The program has multiple functions, methods, procedures, macros, etc. that contain the same code.",Redundant code can clutter the development repository and lead to complexity errors. Code redundancy emerges from the development phase and can be resolved during review passes. It is important for developers to establish a routine phase of code refactoring.,,,"api errors, function errors",Code Quality,selectivity,Medium,lack of review,Low,,,selectivity,Review,,,,,
1079,https://cwe.mitre.org/data/definitions/1079,Parent Class without Virtual Destructor Method,Theo,"A parent class contains one or more child classes, but the parent class does not have a virtual destructor method.","In C++, it is undefined behavior to derive from a class that does not have a virtual destructor. Classes with no children do not have this requirement. The developer may not be aware of this feature of the programming language.",,reduce reliability,,Code Quality,strong now wrong,Medium,lack of knowledge,Low,,,lack of knowledge,Coding,,,,,
1063,https://cwe.mitre.org/data/definitions/1063,Creation of Class Instance within a Static Code Block,Theo,A static code block creates an instance of a class.,"This issue can make the product perform more slowly by performing initialization before it is needed. If the relevant code is reachable by an attacker, then this performance problem might introduce a vulnerability.",,,automated static analysis,Time and State,biased review,High,,,,,,Design,,,,,
609,https://cwe.mitre.org/data/definitions/609,Double-Checked Locking,Theo,The program uses double-checked locking to access a resource in place of synchronization mechanisms and the locking is insufficient.,"In some languages, atomic synchronization can be substituted for ""double-checked locking"". However, this functionality is not supported in all languages and could result in a race condition.",,modify application data,,Time and State,strong now wrong,High,,,,,strong now wrong,Coding,,,,,
1124,https://cwe.mitre.org/data/definitions/1124,Excessively Deep Nesting,Theo,The code contains a callable or other code grouping in which the nesting / branching is too deep.,Excessive nesting is often a symptom of a lack of code refactoring. Developers should move deeply nested code into a new function to reduce code complexity.,,,"resource locking, resource management, automated static analysis",Code Quality,selectivity,Medium,lack of review,Low,,,,Review,,,,,
134,https://cwe.mitre.org/data/definitions/134,Use of Externally-Controlled Format String,Rylan,"During execution of non-reentrant code, the product performs a call that unintentionally produces a nested invocation of the non-reentrant code.
","A developer may be required to review a heavily nested function, and fail to consider global dependencies hidden beneath a high number of layers.",,"read memory, modify memory, execute unauthorized code","file handling, attack surface reduction",Input Validation and Representation,unknown,High,,,,,unknown,Review,,,,,
268,https://cwe.mitre.org/data/definitions/268,Privilege Chaining,Rylan,"Two distinct privileges, roles, capabilities, or rights can be combined in a way that allows an entity to perform unsafe actions that would not be allowed without that combination.
","A developer may be required to review distinct roles/groups for security, but fail to consider the interactions they have with eachother.",,gain privileges,"string errors, input validation",Encapsulation,biased review,High,,,,,biased review,Review,,,,,
468,https://cwe.mitre.org/data/definitions/468,Incorrect Pointer Scaling,Rylan,"In C and C++, one may often accidentally refer to the wrong memory due to the semantics of when math operations are implicitly scaled.
","A developer may be required to increment a pointer value by one byte, and assume it should increment by one. In many cases, this will increment by the size of one data type, as opposed to one byte.",,"read memory, modify memory","separation of privileges, environment hardening, authorize actors",Code Quality,rule deficiencies,High,,,,,rule deficiencies,Coding,,,,,
1082,https://cwe.mitre.org/data/definitions/1082,Class Instance Self Destruction Control Element,Rylan,"The code contains a class instance that calls the method or function to delete or destroy itself.
","It is bad practice for a class to delete itself, however a developer may be unaware of this rule and implement it in their code.",,,"memory buffer errors, pointer issues",Code Quality,lack of knowledge,High,,,,,rule deficiencies,Design,,,,,
301,https://cwe.mitre.org/data/definitions/301,Reflection Attack in an Authentication Protocol,Rylan,"Simple authentication protocols are subject to reflection attacks if a malicious user can use the target machine to impersonate a trusted user.
","A developer reviewing a secure authentication scheme may verify its integrity, but fail to consider a case where a malicuous user reflects previously requested hashes to gain authentication.",,gain privileges,"authorize actors, cryptography",API Abuse,biased review,High,,,,,biased review,Review,,,,,
308,https://cwe.mitre.org/data/definitions/308,Use of Single-factor Authentication,Rylan,"The use of single-factor authentication can lead to unnecessary risk of compromise when compared with the benefits of a dual-factor authentication scheme.
","Developers may have designed software in the past utilizing single factor authentication, failing to realize the robust and numerous attacks it is susceptible to in modern times.",,bypass protection mechanism,authorize actors,Security Features,lack of knowledge,High,,,,,strong now wrong,Design,,,,,
257,https://cwe.mitre.org/data/definitions/257,Storing Passwords in a Recoverable Format,Rylan,The storage of passwords in a recoverable format makes them subject to password reuse attacks by malicious users.,"Developers may believe two-way formats such as compression are sufficient in encrypting a password, which is not the case.",,"gain privileges, access control",encryption,Security Features,lack of knowledge,High,,,,,,Coding,,,,,
824,https://cwe.mitre.org/data/definitions/824,Access of Uninitialized Pointer,Rylan,"The product accesses or uses a pointer that has not been initialized.
","A developer may be tasked with the creation and utilization of a pointer. However, utilization of the pointer may be more important, and ensuring it has been properly initialized may be omitted as a result.",,"read memory, system crash, system restart, execute unauthorized code","pointer issues, memory buffer errors",Code Quality,post completion,Medium,,,,,,Coding,,,,,
477,https://cwe.mitre.org/data/definitions/477,Use of Obsolete Function,Rylan,"The code uses deprecated or obsolete functions, which suggests that the code has not been actively reviewed or maintained.
","When reviewing code, developers may encounter outdated methods that worked in the past, but now pose security risks. They may fail to consider cases such as this.",,quality degradation,"api errors, function errors",API Abuse,biased review,High,,,,,biased review,Review,,,,,
1113,https://cwe.mitre.org/data/definitions/1113,Inappropriate Comment Style,Rylan,"The source code uses comment styles or formats that are inconsistent or do not follow expected standards for the product.
","Developers may utilize comment conventions that have been succesful in the past, but do not meet the requirements of the current project.",,"modify application data, gain privileges","input validation, output encoding, neutralization",Code Quality,strong now wrong,High,,,,,strong now wrong,Coding,,,,,
605,https://cwe.mitre.org/data/definitions/605,Multiple Binds to the Same Port,Rylan,"When multiple sockets are allowed to bind to the same port, other services on that port may be stolen or spoofed.
","When reviewing software uitilizing sockets, developers may confirm functionality, but fail to consider shared sockets across program, potentially leading to a security vulnerability.",,read application data,policy,Encapsulation,biased review,High,,,,,biased review,Review,,,,,
444,https://cwe.mitre.org/data/definitions/444,Inconsistent Interpretation of HTTP Requests ('HTTP Request/Response Smuggling'),Rylan,"The product acts as an intermediary HTTP agent (such as a proxy or firewall) in the data flow between two entities such as a client and server, but it does not interpret malformed HTTP requests or responses in ways that are consistent with how the messages will be processed by those entities that are at the ultimate destination.
","While designing and intermediary HTTP agent, a developer may design in it a non-functional way for the host failing to realize the specific requirements laid by the host.",,"unexpected state, bypass protection mechanism",automated static analysis,API Abuse,rule deficiencies,Medium,,,,,,Design,,,,,
179,https://cwe.mitre.org/data/definitions/179,Incorrect Behavior Order: Early Validation,Rylan,"The product validates input before applying protection mechanisms that modify the input, which could allow an attacker to bypass the validation via dangerous inputs that only arise after the modification.
","The design of an application may be broken into multiple steps, including validating input and applying protection mechanisms. After implementing, the developer may fail to sequence these components correctly as specified by the main goal.",,"bypass protection mechanism, execute unauthorized code",input validation,Time and State,sequencing issues,High,,,,,lack of knowledge - sequencing issues,Coding,,,,,
603,https://cwe.mitre.org/data/definitions/603,Use of Client-Side Authentication,Rylan,"A client/server product performs authentication within client code but not in server code, allowing server-side authentication to be bypassed via a modified client that omits the authentication check.
",Developers may be unaware of the ease client-side authentication provides for malicuous users to spoof authentication.,,"bypass protection mechanism, gain privileges",authorize actors,Encapsulation,lack of knowledge,High,,,,,lack of knowledge,Design,,,,,
532,https://cwe.mitre.org/data/definitions/532,Insertion of Sensitive Information into Log File,Marvin,Information written to log files can be of a sensitive nature and give valuable guidance to an attacker or expose sensitive user information.,"Developers may not be aware of the sensitive nature of information that is written to log files, or they may not understand the potential risks of exposing this information to attackers.",,read application data,"internal compromise, audit, sensitive information",Encapsulation,lack of knowledge,High,,,,,lack of knowledge,Design,,,,,
785,https://cwe.mitre.org/data/definitions/785,Use of Path Manipulation Function without Maximum-sized Buffer,Marvin,"The product invokes a function for normalizing paths or file names, but it provides an output buffer that is smaller than the maximum possible size, such as PATH_MAX.",Developers may not know that the path is limited in size.,,"modify memory, execute unauthorized code, system crash, system restart","input validation, memory buffer errors",Code Quality,biased review,Medium,lack of knowledge,Low,,,lack of knowledge,Coding,,,,,
1333,https://cwe.mitre.org/data/definitions/1333,Inefficient Regular Expression Complexity,Marvin,"The product uses a regular expression with an inefficient, possibly exponential worst-case computational complexity that consumes excessive CPU cycles.",This may be caused by not fully grasping that regex can exponentially scale in computation and not understanding how regex works in backtracking.,,resource consumption,algorithmic complexity,Code Quality,difficulties with exponents,Medium,lack of knowledge,Low,,,difficulties with exponents,Coding,,,,,
233,https://cwe.mitre.org/data/definitions/233,Improper Handling of Parameters,Marvin,"The product does not properly handle when the expected number of parameters, fields, or arguments is not provided in input, or if those parameters are undefined.",This suggests a developer did not check their work and it did not occur to them that an input field could be blank/incorrect/etc. ,,unexpected state,parameter handling,,biased review,High,lack of knowledge,Low,,,biased review,Design,,,,,
1064,https://cwe.mitre.org/data/definitions/1064,Invokable Control Element with Signature Containing an Excessive Number of Parameters,Marvin,"The product contains a function, subroutine, or method whose signature has an unnecessarily large number of parameters/arguments. ",The issue is excessive code complexity which can cause issues when humans have a hard time managing/maintaining/tracking everything required for the function.,,,,Code Quality,complexity,High,,,,,,Coding,,,,,
1277,https://cwe.mitre.org/data/definitions/1277,Firmware Not Updateable,Marvin,The product does not provide its users with the ability to update or patch its firmware to address any vulnerabilities or weaknesses that may be present.,The company/dev does not envision or provide for ways to protect the product against novel attacks that may occur in the future.,,"gain privileges, bypass protection mechanism, execute unauthorized code, system crash, system restart","authentication, firmware",,security culture,High,,,,,security culture,Design,,,,,
1091,https://cwe.mitre.org/data/definitions/1091,Use of Object without Invoking Destructor Method,Marvin,"The product contains a method that accesses an object but does not later invoke the element's associated finalize/destructor method.
This issue can make the product perform more slowly by retaining memory and/or other resources longer than necessary. If the relevant code is reachable by an attacker, then this performance problem might introduce a vulnerability.",The developer may not be aware that objects should be destroyed after they are no longer needed.,,Quality degradation,automated static analysis,Time and State,lack of knowledge,Medium,post completion,Low,,,,Coding,,,,,
460,https://cwe.mitre.org/data/definitions/460,Improper Cleanup on Thrown Exception,Marvin,"The product does not clean up its state or incorrectly cleans up its state when an exception is thrown, leading to unexpected state or control flow.
Often, when functions or loops become complicated, some level of resource cleanup is needed throughout execution. Exceptions can disturb the flow of the code and prevent the necessary cleanup from happening.",The developer forgot to implement this requirement.,,,"automated static analysis, resource cleanup",Errors,post completion,High,,,,,post completion,Design,,,,,
1320,https://cwe.mitre.org/data/definitions/1320,Improper Protection for Outbound Error Messages and Alert Signals,Marvin,"Untrusted agents can disable alerts about signal conditions exceeding limits or the response mechanism that handles such alerts.
Hardware sensors are used to detect whether a device is operating within design limits. The threshold values for these limits are set by hardware fuses or trusted software such as a BIOS. Modification of these limits may be protected by hardware mechanisms.","The designers/engineers did not think about securing these warning signals/etc as they are not usually issues, but can be abused for performance/dos.",,"system crash, system restart, instability, unexpected state",access control,Errors,security culture,High,,,,,biased review,Design,,,,,
486,https://cwe.mitre.org/data/definitions/486,Comparison of Classes by Name,Marvin,"The product compares classes by name, which can cause it to use the wrong class when multiple classes can have the same name.",Developers may create classes without considering the potential for name collisions and could be unaware of the risks of comparing classes by name if any potential user input is far removed from their logic.,,execute unauthorized code,mapping objects,Encapsulation,lack of knowledge,High,lack of review,,,,rule deficiencies,Coding,,,,,
